{
  "review_schema_version": 3,
  "article": "medium/generated/agentic-ai-engineering/2026-08-31-part-01-what-makes-an-ai-agent-different-from-a-chatbot.md",
  "canonical_markdown_sha256": "f7ff0054edd38e5921d8f74e51ca98b558609608d77f2f1ba720f81e3e800bfe",
  "reviewer": "Codex adversarial technical-editorial review",
  "reviewed_at_utc": "2026-10-21T03:37:07Z",
  "review_roles": ["technical", "evidence", "pedagogy", "reproducibility", "originality", "accessibility", "global-English"],
  "reader_value_score": 90,
  "threshold": 85,
  "decision": "approved",
  "human_approved": true,
  "categories": [
    {"name": "Reader promise and original contribution", "score": 11, "maximum": 12, "evidence": "The control-ownership test and reusable boundary card give readers a decision artifact beyond a definition survey."},
    {"name": "Technical correctness and nuance", "score": 16, "maximum": 18, "evidence": "The corrected state machine consumes budgets, fails closed on denial, matches approvals, preserves operation identity, and refuses unverified completion; production persistence and identity verification remain explicit limitations."},
    {"name": "Knowledge depth and progression", "score": 14, "maximum": 16, "evidence": "The lesson progresses from interface ambiguity to operational definition, loop, state machine, worked trace, failure boundaries, and architecture choice without requiring a framework."},
    {"name": "Reproducibility and runnable evidence", "score": 14, "maximum": 16, "evidence": "A standard-library implementation and seven deterministic tests cover success, approval, denial, failure exhaustion, unknown outcome retry, budget termination, and false completion."},
    {"name": "Failures, trade-offs, and evaluation", "score": 11, "maximum": 12, "evidence": "The trace and failure table separate planning, policy, tool, state, distributed-write, and verification failures while explaining when a deterministic workflow is preferable."},
    {"name": "Pedagogy and transfer", "score": 9, "maximum": 10, "evidence": "Observable outcomes align with the worked case, boundary-card exercise, self-check, retrieval questions, and transfer prompt."},
    {"name": "Visual explanation and accessibility", "score": 7, "maximum": 8, "evidence": "Two captioned SVG diagrams provide a system comparison and state-transition view with equivalent descriptions and editable Draw.io sources."},
    {"name": "Evidence and publishing trust", "score": 8, "maximum": 8, "evidence": "Primary guidance, bounded practitioner synthesis, a claim register, tested versions, AI disclosure, and explicit implementation limitations support reader trust."}
  ],
  "critical_issues": []
}
